unseenwizzard/learn-git-concepts-not-commands-4gjc,Nico Riedmann,"Learn git concepts, not commands","An interactive git tutorial meant to teach you how git works, not just which commands to execute.

So, you want to use git right?

But you don't just want to learn commands, you want to understand what you're using?

Then this is meant for you!

Let's get started!

Based on the general concept from Rachel M. Carmena's blog post on How to teach Git.

While I find many git tutorials on the internet to be too focused on what to do instead of how things work, the most invaluable resource for both (and source for this tutorial!) are the git Book and Reference page.

So if you're still interested when you're done here, go check those out! I do hope the somewhat different concept of this tutorial will aid you in understanding all the other git features detailed there.

In the picture below you see four boxes. One of them stands alone, while the other three are grouped together in what I'll call your Development Environment.



We'll start with the one that's on it's own though. The Remote Repository is where you send your changes when you want to share them with other people, and where you get their changes from. If you've used other version control systems there's nothing interesting about that.

The Development Environment is what you have on your local machine. 
The three parts of it are your Working Directory, the Staging Area and the Local Repository. We'll learn more about those as we start using git.

Choose a place in which you want to put your Development Environment. 
Just go to your home folder, or where ever you like to put your projects. You don't need to create a new folder for your Dev Environment though.

Now we want to grab a Remote Repository and put what's in it onto your machine.

I'd suggest we use this one (https://github.com/UnseenWizzard/git_training.git if you're not already reading this on github).

To do that I can use git clone https://github.com/UnseenWizzard/git_training.git

But as following this tutorial will need you to get the changes you make in your Dev Environment back to the Remote Repository, and github doesn't just allow anyone to do that to anyone's repo, you'll best create a fork of it right now. There's a button to do that on the top right of this page.

Now that you have a copy of my Remote Repository of your own, it's time to get that onto your machine.

For that we use git clone https://github.com/{YOUR USERNAME}/git_training.git

As you can see in the diagram below, this copies the Remote Repository into two places, your Working Directory and the Local Repository. 
Now you see how git is distributed version control. The Local Repository is a copy of the Remote one, and acts just like it. The only difference is that you don't share it with anyone.

What git clone also does, is create a new folder wherever you called it. There should be a git_training folder now. Open it.



Someone already put a file into the Remote Repository. It's Alice.txt, and kind of lonely there. Let's create a new file and call it Bob.txt.

What you've just done is add the file to your Working Directory. 
There's two kinds of files in your Working Directory: tracked files that git knows about and untracked files that git doesn't know about (yet).

To see what's going on in your Working Directory run git status, which will tell you what branch you're on, whether your Local Repository is different from the Remote and the state of tracked and untracked files.

You'll see that Bob.txt is untracked, and git status even tells you how to change that. 
In the picture below you can see what happens when you follow the advice and execute git add Bob.txt: You've added the file to the Staging Area, in which you collect all the changes you wish to put into Repository



When you have added all your changes (which right now is only adding Bob), you're ready to commit what you just did to the Local Repository.

The collected changes that you commit are some meaningful chunk of work, so when you now run git commit a text editor will open and allow you to write a message telling everything what you just did. When you save and close the message file, your commit is added to the Local Repository.



You can also add your commit message right there in the command line if you call git commit like this: git commit -m ""Add Bob"". But because you want to write good commit messages you really should take your time and use the editor.

Now your changes are in your local repository, which is a good place for the to be as long as no one else needs them or you're not yet ready to share them.

In order to share your commits with the Remote Repository you need to push them.



Once you run git push the changes will be sent to the Remote Repository. In the diagram below you see the state after your push.



So far we've only added a new file. Obviously the more interesting part of version control is changing files.

Have a look at Alice.txt.

It actually contains some text, but Bob.txt doesn't, so lets change that and put Hi!! I'm Bob. I'm new here. in there.

If you run git status now, you'll see that Bob.txt is modified. 
In that state the changes are only in your Working Directory.

If you want to see what has changed in your Working Directory you can run git diff, and right now see this:

Go ahead and git add Bob.txt like you've done before. As we know, this moves your changes to the Staging Area.

I want to see the changes we just staged, so let's show the git diff again! You'll notice that this time the output is empty. This happens because git diff operates on the changes in your Working Directory only.

To show what changes are staged already, we can use git diff --staged and we'll see the same diff output as before.

I just noticed that we put two exclamation marks after the 'Hi'. I don't like that, so lets change Bob.txt again, so that it's just 'Hi!'

If we now run git status we'll see that there's two changes, the one we already staged where we added text, and the one we just made, which is still only in the working directory.

We can have a look at the git diff between the Working Directory and what we've already moved to the Staging Area, to show what has changed since we last felt ready to stage our changes for a commit.

As the change is what we wanted, let's git add Bob.txt to stage the current state of the file.

Now we're ready to commit what we just did. I went with git commit -m ""Add text to Bob"" because I felt for such a small change writing one line would be enough.

As we know, the changes are now in the Local Repository. 
We might still want to know what change we just committed and what was there before.

We can do that by comparing commits. 
Every commit in git has a unique hash by which it is referenced.

If we have a look at the git log we'll not only see a list of all the commits with their hash as well as Author and Date, we also see the state of our Local Repository and the latest local information about remote branches.

Right now the git log looks something like this:

In there we see a few interesting things:

Note that the actual commit hashes will be different for you. If you want to know how exactly git arrives at those revision IDs have a look at this interesting article .

To compare that commit and the one one before we can do git diff <commit>^!, where the ^! tells git to compare to the commit one before. So in this case I run git diff 87a4ad48d55e5280aa608cd79e8bce5e13f318dc^!

We can also do git diff 8af2ff2a8f7c51e2e52402ecb7332aec39ed540e 87a4ad48d55e5280aa608cd79e8bce5e13f318dc for the same result and in general to compare any two commits. Note that the format here is git diff <from commit> <to commit>, so our new commit comes second.

In the diagram below you again see the different stages of a change, and the diff commands that apply to where a file currently is.



Now that we're sure we made the change we wanted, go ahead and git push.

Another thing that makes git great, is the fact that working with branches is really easy and integral part of how you work with git.

In fact we've been working on a branch since we've started.

When you clone the Remote Repository your Dev Environment automatically starts on the repositories main or master branch.

Most work-flows with git include making your changes on a branch, before you merge them back into master. 
Usually you'll be working on your own branch, until you're done and confident in your changes which can then be merged into the master.

Many git repository managers like GitLab and GitHub also allow for branches to be protected, which means that not everyone is allowed to just push changes there. There the master is usually protected by default.

Don't worry, we'll get back to all of these things in more detail when we need them.

Right now we want to create a branch to make some changes there. Maybe you just want to try something on your own and not mess with the working state on your master branch, or you're not allowed to push to master.

Branches live in the Local and Remote Repository. When you create a new branch, the branches contents will be a copy of the currently committed state of whatever branch you are currently working on.

Let's make some change to Alice.txt! How about we put some text on the second line?

We want to share that change, but not put it on master right away, so let's create a branch for it using git branch <branch name>.

To create a new branch called change_alice you can run git branch change_alice.

This adds the new branch to the Local Repository.

While your Working Directory and Staging Area don't really care about branches, you always commit to the branch you are currently on.

You can think of branches in git as pointers, pointing to a series of commits. When you commit, you add to whatever you're currently pointing to.

Just adding a branch, doesn't directly take you there, it just creates such a pointer. 
In fact the state your Local Repository is currently at, can be viewed as another pointer, called HEAD, which points to what branch and commit you are currently at.

If that sounds complicated the diagrams below will hopefully help to clear things up a bit:



To switch to our new branch you will have to use git checkout change_alice. What this does is simply to move the HEAD to the branch you specify.

As you'll usually want switch to a branch right after creating it, there is the convenient -b option available for the checkout command, which allows you to just directly checkout a new branch, so you don't have to create it beforehand.

So to create and switch to our change_alice branch, we could also just have called git checkout -b change_alice.



You'll notice that your Working Directory hasn't changed. That we've modified Alice.txt is not related to the branch we're on yet. 
Now you can add and commit the change to Alice.txt just like we did on the master before, which will stage (at which point it's still unrelated to the branch) and finally commit your change to the change_alice branch.

There's just one thing you can't do yet. Try to git push your changes to the Remote Repository.

You'll see the following error and - as git is always ready to help - a suggestion how to resolve the issue:

But we don't just want to blindly do that. We're here to understand what's actually going on. So what are upstream branches and remotes?

Remember when we cloned the Remote Repository a while ago? At that point it didn't only contain this tutorial and Alice.txt but actually two branches.

The master we just went ahead and started working on, and one I called ""tutorial_wip"" on which I commit all the changes I make to this tutorial.

When we copied the things in the Remote Repository into your Dev Environment a few extra steps happened under the hood.

Git setup the remote of your Local Repository to be the Remote Repository you cloned and gave it the default name origin.

Your Local Repository can track several remotes and they can have different names, but we'll stick to the origin and nothing else for this tutorial.

Then it copied the two remote branches into your Local Repository and finally it checked out master for you.

When doing that another implicit step happens. When you checkout a branch name that has an exact match in the remote branches, you will get a new local branch that is linked to the remote branch. The remote branch is the upstream branch of your local one.

In the diagrams above you can see just the local branches you have. You can see that list of local branches by running git branch.

If you want to also see the remote branches your Local Repository knows, you can use git branch -a to list all of them.



Now we can call the suggested git push --set-upstream origin change_alice, and push the changes on our branch to a new remote. This will create a change_alice branch on the Remote Repository and set our local change_alice to track that new branch.

There is another option if we actually want our branch to track something that already exists on the Remote Repository. Maybe a colleague has already pushed some changes, while we were working on something related on our local branch, and we'd like to integrate the two. Then we could just set the upstream for our change_alice branch to a new remote by using git branch --set-upstream-to=origin/change_alice and from there on track the remote branch.

After that went through have a look at your Remote Repository on github, your branch will be there, ready for other people to see and work with.

We'll get to how you can get other people's changes into your Dev Environment soon, but first we'll work a bit more with branches, to introduce all the concepts that also come into play when we get new things from the Remote Repository.

As you and everyone else will generally be working on branches, we need to talk about how to get changes from one branch into the other by merging them.

We've just changed Alice.txt on the change_alice branch, and I'd say we're happy with the changes we made.

If you go and git checkout master, the commit we made on the other branch will not be there. To get the changes into master we need to merge the change_alice branch into master.

Note that you always merge some branch into the one you're currently at.

As we've already checked out master, we can now git merge change_alice.

As there are no other conflicting changes to Alice.txt, and we've changed nothing on master, this will go through without a hitch in what is called a fast forward merge.

In the diagrams below, you can see that this just means that the master pointer can simply be advanced to where the change_alice one already is.

The first diagram shows the state before our merge, master is still at the commit it was, and on the other branch we've made one more commit.



The second diagram shows what has changed with our merge.



Let's try something more complex.

Add some text on a new line to Bob.txt on master and commit it.

Then git checkout change_alice, change Alice.txt and commit.

In the diagram below you see how our commit history now looks. Both master and change_alice originated from the same commit, but since then they diverged, each having their own additional commit.



If you now git merge change_alice a fast-forward merge is not possible. Instead your favorite text editor will open and allow you to change the message of the merge commit git is about to make in order to get the two branches back together. You can just go with the default message right now. The diagram below shows the state of our git history after we the merge.



The new commit introduces the changes that we've made on the change_alice branch into master.

As you'll remember from before, revisions in git, aren't only a snapshot of your files but also contain information on where they came from from. Each commit has one or more parent commits. Our new merge commit, has both the last commit from master and the commit we made on the other branch as it's parents.

So far our changes haven't interfered with each other.

Let's introduce a conflict and then resolve it.

Create and checkout a new branch. You know how, but maybe try using git checkout -b to make your live easier. 
I've called mine bobby_branch.

On the branch we'll make a change to Bob.txt. 
The first line should still be Hi!! I'm Bob. I'm new here.. Change that to Hi!! I'm Bobby. I'm new here.

Stage and then commit your change, before you checkout master again. Here we'll change that same line to Hi!! I'm Bob. I've been here for a while now. and commit your change.

Now it's time to merge the new branch into master. 
When you try that, you'll see the following output

Auto-merging Bob.txt
    CONFLICT (content): Merge conflict in Bob.txt
    Automatic merge failed; fix conflicts and then commit the result.

The same line has changed on both of the branches, and git can't handle this on it's own.

If you run git status you'll get all the usual helpful instructions on how to continue.

First we have to resolve the conflict by hand.

For an easy conflict like this one your favorite text editor will do fine. For merging large files with lots of changes a more powerful tool will make your life much easier, and I'd assume your favorite IDE comes with version control tools and a nice view for merging.

If you open Bob.txt you'll see something similar to this (I've truncated whatever we might have put on the second line before):

<<<<<<< HEAD
    Hi! I'm Bob. I've been here for a while now.
    =======
    Hi! I'm Bobby. I'm new here.
    >>>>>>> bobby_branch
    [... whatever you've put on line 2]

On top you see what has changed in Bob.txt on the current HEAD, below you see what has changed in the branch we're merging in.

To resolve the conflict by hand, you'll just need to make sure that you end up with some reasonable content and without the special lines git has introduced to the file.

So go ahead and change the file to something like this:

Hi! I'm Bobby. I've been here for a while now.
    [...]

From here what we're doing is exactly what we'd do for any changes. 
We stage them when we add Bob.txt, and then we commit.

We already know the commit for the changes we've made to resolve the conflict. It's the merge commit that is always present when merging.

Should you ever realize in the middle of resolving conflicts that you actually don't want to follow through with the merge, you can just abort it by running git merge --abort.

Git has another clean way to integrate changes between two branches, which is called rebase.

We still recall that a branch is always based on another. When you create it, you branch away from somewhere.

In our simple merging example we branched from master at a specific commit, then committed some changes on both master and the change_alice branch.

When a branch is diverging from the one it's based on and you want to integrate the latest changes back into your current branch, rebase offers a cleaner way of doing that than a merge would.

As we've seen, a merge introduces a merge commit in which the two histories get integrated again.

Viewed simply, rebasing just changes the point in history (the commit) your branch is based on.

To try that out, let's first checkout the master branch again, then create/checkout a new branch based on it. 
I called mine add_patrick and I added a new Patrick.txt file and committed that with the message 'Add Patrick'.

When you've added a commit to the branch, get back to master, make a change and commit it. I added some more text to Alice.txt.

Like in our merging example the history of these two branches diverges at a common ancestor as you can see in the diagram below.



Now let's checkout add_patrick again, and get that change that was made on master into the branch we work on!

When we git rebase master, we re-base our add_patrick branch on the current state of the master branch.

The output of that command gives us a nice hint at what is happening in it:

First, rewinding head to replay your work on top of it...
    Applying: Add Patrick

As we remember HEAD is the pointer to the current commit we're at in our Dev Environment.

It's pointing to the same place as add_patrick before the rebase starts. For the rebase, it then first moves back to the common ancestor, before moving to the current head of the branch we want to re-base ours on.

So HEAD moves from the 0cfc1d2 commit, to the 7639f4b commit that is at the head of master. 
Then rebase applies every single commit we made on our add_patrick branch to that.

To be more exact what git does after moving HEAD back to the common ancestor of the branches, is to store parts of every single commit you've made on the branch (the diff of changes, and the commit text, author, etc.).

After that it does a checkout of the latest commit of the branch you're rebasing on, and then applies each of the stored changed as a new commit on top of that.

So in our original simplified view, we'd assume that after the rebase the 0cfc1d2 commit doesn't point to the common ancestor anymore in it's history, but points to the head of master. 
In fact the 0cfc1d2 commit is gone, and the add_patrick branch starts with a new 0ccaba8 commit, that has the latest commit of master as its ancestor. 
We made it look, like our add_patrick was based on the current master not an older version of it, but in doing so we re-wrote the history of the branch.
At the end of this tutorial we'll learn a bit more about re-writing history and when it's appropriate and inappropriate to do so.



Rebase is an incredibly powerful tool when you're working on your own development branch which is based on a shared branch, e.g. the master.

Using rebase you can make sure that you frequently integrate the changes other people make and push to master, while keeping a clean linear history that allows you to do a fast-forward merge when it's time to get your work into the shared branch.

Keeping a linear history also makes reading or looking at (try out git log --graph or take a look at the branch view of GitHub or GitLab) commit logs much more useful than having a history littered with merge commits, usually just using the default text.

Just like for a merge you may run into conflicts, if you run into two commits changing the same parts of a file.

However when you encounter a conflict during a rebase you don't fix it in an extra merge commit, but can simply resolve it in the commit that is currently being applied. 
Again, basing your changes directly on the current state of the original branch.

Actually resolving conflicts while you rebase is very similar to how you would for a merge so refer back to that section if you're not sure anymore how to do it.

The only distinction is, that as you're not introducing a merge commit there is no need to commit your resolution. Simply add the changes to the Staging Environment and then git rebase --continue. The conflict will be resolved in the commit that was just being applied.

As when merging, you can always stop and drop everything you've done so far when you git rebase --abort.

So far we've only learned how to make and share changes.

That fits what you'll do if you're just working on your own, but usually there'll be a lot of people that do just the same, and we're gonna want to get their changes from the Remote Repository into our Dev Environment somehow.

Because it has been a while, lets have another look at the components of git:



Just like your Dev Environment everyone else working on the same source code has theirs.



All of these Dev Environments have their own working and staged changes, that are at some point committed to the Local Repository and finally pushed to the Remote.

For our example, we'll use the online tools offered by GitHub, to simulate someone else making changes to the remote while we work.

Go to your fork of this repo on github.com and open the Alice.txt file.

Find the edit button and make and commit a change via the website.



In this repository I have added a remote change to Alice.txt on a branch called fetching_changes_sample, but in your version of the repository you can of course just change the file on master.

We still remember that when you git push, you synchronize changes made to the Local Repository into the Remote Repository.

To get changes made to the Remote into your Local Repository you use git fetch.

This gets any changes on the remote - so commits as well as branches - into your Local Repository.

Note that at this point, changes aren't integrated into the local branches and thus the Working Directory and Staging Area yet.



If you run git status now, you'll see another great example of git commands telling you exactly what is going on:

git status
    On branch fetching_changes_sample
    Your branch is behind 'origin/fetching_changes_sample' by 1 commit, and can be fast-forwarded.
      (use ""git pull"" to update your local branch)

As we have no working or staged changes, we could just execute git pull now to get the changes from the Repository all the way into our working area.

Pulling will implicitly also fetch the Remote Repository, but sometimes it is a good idea to do a fetch on it's own. 
For example when you want to synchronize any new remote branches, or when you want to make sure your Local Repository is up to date before you do a git rebase on something like origin/master.



Before we pull, lets change a file locally to see what happens.

Lets also change Alice.txt in our Working Directory now!

If you now try to do a git pull you'll see the following error:

git pull
    Updating df3ad1d..418e6f0
    error: Your local changes to the following files would be overwritten by merge:
            Alice.txt
    Please commit your changes or stash them before you merge.
    Aborting

